[
  {
    "identity": {
      "id": "unexcavated_rock",
      "name": "Unexcavated Rock",
      "category": "Geology"
    },
    "form": {
      "footprint": {"width": 1, "height": 1},
      "renderFamily": "mountain_rock",
      "variant": "standard",
      "supportsDamageVariants": false,
      "supportsConstructionVariants": true
    },
    "rules": {
      "excavation": {
        "supportsExcavation": true,
        "yieldTypes": ["supply"],
        "yieldRange": {"min": 0, "max": 2},
        "notes": "Standard excavatable mountain rock."
      },
      "construction": {
        "supportsPlacement": false,
        "supportsRoomConstruction": false,
        "blocksConstruction": true,
        "notes": "Must be excavated before the tile can host a room."
      },
      "visibility": {
        "supportsFogOfWar": true,
        "revealBehavior": "hidden_until_excavated",
        "notes": "Obscures unrevealed interior base space."
      },
      "geology": {
        "geologyType": "ordinary_rock",
        "hardnessTier": 1,
        "supportsEvents": true,
        "eventFamilies": ["geology", "excavation"],
        "notes": "Default mountain composition."
      }
    },
    "function": {
      "base": "Solid mountain rock awaiting excavation.",
      "transitionOnExcavate": "excavated_empty"
    },
    "visual": {
      "shellFamily": "sgc_mountain",
      "mountainContext": true,
      "promptNotes": "Cut natural rock with subtle geological variation; no built room shell yet."
    }
  },
  {
    "identity": {
      "id": "hard_rock",
      "name": "Hard Rock",
      "category": "Geology"
    },
    "form": {
      "footprint": {"width": 1, "height": 1},
      "renderFamily": "mountain_rock",
      "variant": "hard",
      "supportsDamageVariants": false,
      "supportsConstructionVariants": true
    },
    "rules": {
      "excavation": {
        "supportsExcavation": true,
        "yieldTypes": ["supply"],
        "yieldRange": {"min": 0, "max": 3},
        "notes": "Harder geological tier requiring more effort to clear."
      },
      "construction": {
        "supportsPlacement": false,
        "supportsRoomConstruction": false,
        "blocksConstruction": true,
        "notes": "Must be excavated before room construction can occur."
      },
      "visibility": {
        "supportsFogOfWar": true,
        "revealBehavior": "hidden_until_excavated",
        "notes": "Remains hidden until excavation succeeds."
      },
      "geology": {
        "geologyType": "hard_rock",
        "hardnessTier": 2,
        "supportsEvents": true,
        "eventFamilies": ["geology", "excavation"],
        "notes": "Dense mountain material that can slow expansion."
      }
    },
    "function": {
      "base": "Hard mountain rock requiring reinforced excavation work.",
      "transitionOnExcavate": "excavated_empty"
    },
    "visual": {
      "shellFamily": "sgc_mountain",
      "mountainContext": true,
      "promptNotes": "Darker denser rock with stronger fracture lines and drill wear."
    }
  },
  {
    "identity": {
      "id": "bedrock",
      "name": "Bedrock",
      "category": "Blocker"
    },
    "form": {
      "footprint": {"width": 1, "height": 1},
      "renderFamily": "mountain_blocker",
      "variant": "bedrock",
      "supportsDamageVariants": false,
      "supportsConstructionVariants": false
    },
    "rules": {
      "excavation": {
        "supportsExcavation": false,
        "notes": "Permanent geological blocker."
      },
      "construction": {
        "supportsPlacement": false,
        "supportsRoomConstruction": false,
        "blocksConstruction": true,
        "notes": "Cannot host rooms or excavation progress."
      },
      "visibility": {
        "supportsFogOfWar": true,
        "revealBehavior": "revealed_when_scanned_or_adjacent",
        "notes": "May be discovered before excavation through geology scanning."
      },
      "geology": {
        "geologyType": "bedrock",
        "hardnessTier": 99,
        "supportsEvents": false,
        "notes": "Absolute excavation boundary."
      }
    },
    "function": {
      "base": "Permanent mountain blocker tile."
    },
    "visual": {
      "shellFamily": "sgc_mountain",
      "mountainContext": true,
      "promptNotes": "Massive immovable geological face with retaining anchors or warning markings if exposed."
    }
  },
  {
    "identity": {
      "id": "excavated_empty",
      "name": "Excavated Empty",
      "category": "Prepared Space"
    },
    "form": {
      "footprint": {"width": 1, "height": 1},
      "renderFamily": "excavated_chamber",
      "variant": "empty",
      "supportsDamageVariants": true,
      "supportsConstructionVariants": true
    },
    "rules": {
      "excavation": {
        "supportsExcavation": false,
        "notes": "Already excavated and ready for use."
      },
      "construction": {
        "supportsPlacement": true,
        "supportsRoomConstruction": true,
        "blocksConstruction": false,
        "notes": "This is the standard empty tile state that can host a room shell."
      },
      "visibility": {
        "supportsFogOfWar": false,
        "revealBehavior": "always_visible_once_created",
        "notes": "Becomes visible when the chamber is opened."
      },
      "geology": {
        "geologyType": "excavated_space",
        "hardnessTier": 0,
        "supportsEvents": true,
        "eventFamilies": ["construction", "maintenance"],
        "notes": "Cut chamber with temporary utilities and usable open floor."
      }
    },
    "function": {
      "base": "Excavated chamber ready for room construction.",
      "transitionOnRemoveRoom": "excavated_empty"
    },
    "visual": {
      "shellFamily": "sgc_mountain",
      "mountainContext": true,
      "circulationMargin": "20_percent",
      "promptNotes": "Cut rock chamber with rough floor, temporary lighting, and utility stubs ready for construction."
    }
  },
  {
    "identity": {
      "id": "void",
      "name": "Void",
      "category": "Hazard"
    },
    "form": {
      "footprint": {"width": 1, "height": 1},
      "renderFamily": "natural_void",
      "variant": "cavern",
      "supportsDamageVariants": false,
      "supportsConstructionVariants": false
    },
    "rules": {
      "excavation": {
        "supportsExcavation": false,
        "notes": "Already open but not automatically usable as a base floor tile."
      },
      "construction": {
        "supportsPlacement": false,
        "supportsRoomConstruction": false,
        "blocksConstruction": true,
        "notes": "Requires special support/bridging logic before standard room construction."
      },
      "visibility": {
        "supportsFogOfWar": true,
        "revealBehavior": "revealed_when_exposed",
        "notes": "May be unexpectedly uncovered during excavation."
      },
      "geology": {
        "geologyType": "void",
        "hardnessTier": 0,
        "supportsEvents": true,
        "eventFamilies": ["hazard", "discovery"],
        "notes": "Open cavern or drop space inside the mountain."
      }
    },
    "function": {
      "base": "Natural open space inside the mountain requiring special treatment."
    },
    "visual": {
      "shellFamily": "sgc_mountain",
      "mountainContext": true,
      "promptNotes": "Dark cavernous drop or open void with exposed rock and unstable edges."
    }
  },
  {
    "identity": {
      "id": "collapsed_prefab",
      "name": "Collapsed Prefab",
      "category": "Special Space"
    },
    "form": {
      "footprint": {"width": 1, "height": 1},
      "renderFamily": "collapsed_structure",
      "variant": "prefab",
      "supportsDamageVariants": true,
      "supportsConstructionVariants": true
    },
    "rules": {
      "excavation": {
        "supportsExcavation": true,
        "yieldTypes": ["supply", "salvage"],
        "yieldRange": {"min": 1, "max": 4},
        "notes": "Can be cleared and salvaged like a special excavation site."
      },
      "construction": {
        "supportsPlacement": false,
        "supportsRoomConstruction": false,
        "blocksConstruction": true,
        "notes": "Must be cleared, stabilized, or converted before normal room construction."
      },
      "visibility": {
        "supportsFogOfWar": true,
        "revealBehavior": "revealed_when_exposed",
        "notes": "Acts like a discovered special chamber."
      },
      "geology": {
        "geologyType": "collapsed_prefab",
        "hardnessTier": 1,
        "supportsEvents": true,
        "eventFamilies": ["salvage", "construction", "incident"],
        "notes": "An old damaged built space embedded in the mountain."
      }
    },
    "function": {
      "base": "Damaged prefabricated chamber that may be cleared, repaired, or salvaged.",
      "transitionOnExcavate": "excavated_empty"
    },
    "visual": {
      "shellFamily": "sgc_mountain",
      "mountainContext": true,
      "promptNotes": "Partially collapsed man-made chamber with exposed framing, debris, damaged lighting, and surrounding rock pressure."
    }
  },
  {
    "identity": {
      "id": "outside_edge",
      "name": "Outside Edge",
      "category": "Boundary"
    },
    "form": {
      "footprint": {"width": 1, "height": 1},
      "renderFamily": "mountain_boundary",
      "variant": "outside",
      "supportsDamageVariants": false,
      "supportsConstructionVariants": false
    },
    "rules": {
      "excavation": {
        "supportsExcavation": false,
        "notes": "Represents the non-buildable exterior boundary."
      },
      "construction": {
        "supportsPlacement": false,
        "supportsRoomConstruction": false,
        "blocksConstruction": true,
        "notes": "Map edge or exterior boundary tile."
      },
      "visibility": {
        "supportsFogOfWar": false,
        "revealBehavior": "always_visible",
        "notes": "Boundary remains visible as part of map framing."
      },
      "geology": {